<?xml version="1.0" encoding="UTF-8"?>
<!DOCTYPE alternativaProyEIA SYSTEM ".\alternativaProyEIA.dtd">
<alternativaProyEIA>
	<nombre generica="true"></nombre>
	<listaAcciones>
		<accion>
			<nombreAccion>Fase de Planeamiento</nombreAccion>
			<listaAcciones>
				<accion>
					<nombreAccion>Diseño y localización de alternativas</nombreAccion>
				</accion>
			</listaAcciones>
		</accion>
		<accion>
			<nombreAccion>Fase de Construcción</nombreAccion>
			<listaAcciones>
				<accion>
					<nombreAccion>Ampliación superficie ganada al mar</nombreAccion>
				</accion>				
				<accion>
					<nombreAccion>Relleno</nombreAccion>
				</accion>
				<accion>
					<nombreAccion>Dragado</nombreAccion>
				</accion>
				<accion>
					<nombreAccion>Diques</nombreAccion>
				</accion>				
				<accion>
					<nombreAccion>Espigones</nombreAccion>
				</accion>
				<accion>
					<nombreAccion>Muelles</nombreAccion>
				</accion>
				<accion>
					<nombreAccion>Edificaciones</nombreAccion>
				</accion>				
				<accion>
					<nombreAccion>Viales</nombreAccion>
				</accion>
				<accion>
					<nombreAccion>Producción de ruido</nombreAccion>
				</accion>
				<accion>
					<nombreAccion>Emisión de polvo</nombreAccion>
				</accion>				
				<accion>
					<nombreAccion>Introducciones flora</nombreAccion>
				</accion>
				<accion>
					<nombreAccion>Uso maquinaria</nombreAccion>
				</accion>
				<accion>
					<nombreAccion>Alteración cubierta terrestre</nombreAccion>
				</accion>				
				<accion>
					<nombreAccion>Explotación de canteras</nombreAccion>
				</accion>
				<accion>
					<nombreAccion>Presupuesto económico de la obra</nombreAccion>
				</accion>
			</listaAcciones>
		</accion>
		<accion>
			<nombreAccion>Fase de Funcionamiento</nombreAccion>
			<listaAcciones>
				<accion>
					<nombreAccion>Navegación</nombreAccion>
				</accion>
				<accion>
					<nombreAccion>Edificios-servicio club</nombreAccion>
				</accion>
				<accion>
					<nombreAccion>Actividades comerciales</nombreAccion>
				</accion>
				<accion>
					<nombreAccion>Actividades industriales (reparaciones)</nombreAccion>
				</accion>
				<accion>
					<nombreAccion>Actividades sociales</nombreAccion>
				</accion>
				<accion>
					<nombreAccion>Actividades educativas</nombreAccion>
				</accion>
				<accion>
					<nombreAccion>Viales-tráfico</nombreAccion>
				</accion>
				<accion>
					<nombreAccion>Abastecimiento agua</nombreAccion>
				</accion>
				<accion>
					<nombreAccion>Saneamiento</nombreAccion>
				</accion>
				<accion>
					<nombreAccion>Vertidos al mar</nombreAccion>
				</accion>
				<accion>
					<nombreAccion>Residuos líquidos (aceite)</nombreAccion>
				</accion>
				<accion>
					<nombreAccion>Afluencia de visitantes</nombreAccion>
				</accion>
				<accion>
					<nombreAccion>Coste Anual de explotación y mantenimiento</nombreAccion>
				</accion>
				<accion>
					<nombreAccion>Accidentes propios de funcionamiento (empleo, riesgos de accidente)</nombreAccion>
				</accion>
				<accion>
					<nombreAccion>Acciones inducidas</nombreAccion>
					<listaAcciones>
						<accion>
							<nombreAccion>Aparición  de urbanizaciones</nombreAccion>
						</accion>
						<accion>
							<nombreAccion>Incremento del valor del suelo</nombreAccion>
						</accion>
						<accion>
							<nombreAccion>Incremento del suelo</nombreAccion>
						</accion>
						<accion>
							<nombreAccion>Incremento del comercio de la zona</nombreAccion>
						</accion>
						<accion>
							<nombreAccion>Edificios náuticos auxiliares</nombreAccion>
						</accion>
					</listaAcciones>
				</accion>
			</listaAcciones>
		</accion>
	</listaAcciones>
</alternativaProyEIA>